<?xml version="1.0" encoding="utf-8"?>
<!-- Created with Liquid Technologies Online Tools 1.0 (https://www.liquid-technologies.com) -->
<xs:schema xmlns:p="controller_adapter_v1" xmlns:xsi="http://www.w3.org/2001/XMLSchema-instance" attributeFormDefault="unqualified" elementFormDefault="qualified" targetNamespace="controller_adapter_v1" xmlns:xs="http://www.w3.org/2001/XMLSchema">
  <xs:element name="controller_adapter_v1">
    <xs:complexType>
      <xs:sequence>
        <xs:element name="subscriptors">
          <xs:complexType>
            <xs:sequence>
              <xs:element maxOccurs="unbounded" name="subscriptor">
                <xs:complexType>
                  <xs:sequence>
                    <xs:element name="id" type="xs:unsignedByte" />
                    <xs:element name="enabled" type="xs:boolean" />
                    <xs:element name="entity" type="xs:string" />
                    <xs:element name="entity_pks" minOccurs="0" maxOccurs="1">
                      <xs:complexType>
                        <xs:sequence>
                          <xs:element maxOccurs="unbounded" name="entity_pk" type="xs:string" />
                        </xs:sequence>
                      </xs:complexType>
                    </xs:element>
                  </xs:sequence>
                </xs:complexType>
              </xs:element>
            </xs:sequence>
          </xs:complexType>
        </xs:element>
        <xs:element name="mods">
          <xs:complexType>
            <xs:sequence>
              <xs:element maxOccurs="unbounded" name="mod">
                <xs:complexType>
                  <xs:sequence>
                    <xs:element name="type" type="xs:long"/>
                    <xs:element name="id" type="xs:long"/>
                    <xs:element name="enabled" type="xs:boolean"/>
                    <xs:element name="threads" type="xs:unsignedByte" minOccurs="0" maxOccurs="1"/>
                    <xs:element name="subscriptors_ref" minOccurs="0" maxOccurs="1">
                      <xs:complexType>
                        <xs:sequence>
                          <xs:element maxOccurs="unbounded" name="subscriptor_id_ref" type="xs:unsignedByte" />
                        </xs:sequence>
                      </xs:complexType>
                    </xs:element>
                    <xs:element name="mod_params" minOccurs="0" maxOccurs="1">
                      <xs:complexType>
                        <xs:sequence>
                          <xs:element maxOccurs="unbounded" name="mod_param_value" type="xs:string" />
                        </xs:sequence>
                      </xs:complexType>
                    </xs:element>
                  </xs:sequence>
                </xs:complexType>
              </xs:element>
            </xs:sequence>
          </xs:complexType>
        </xs:element>
      </xs:sequence>
      <xs:attribute name="name" type="xs:string" use="required" />
      <xs:attribute name="version" type="xs:string" use="required" />
    </xs:complexType>
  </xs:element>
</xs:schema>